{
  "event_id": "44444444-4444-4444-8444-444444444444",
  "event_type": "labeling.dataset_version.published.v1",
  "schema_version": 1,
  "tenant_id": "tenant-1",
  "dataset_version_id": "11111111-1111-4111-8111-111111111111",
  "batch_id": "22222222-2222-4222-8222-222222222222",
  "manifest": {
    "uri": "s3://labeling-published/labeling/tenant-1/22222222-2222-4222-8222-222222222222/11111111-1111-4111-8111-111111111111/manifest.json",
    "version": 1,
    "sha256": "ffffffffffffffffffffffffffffffffffffffffffffffffffffffffffffffff"
  },
  "occurred_at": "2026-10-28T10:05:01Z",
  "correlation_id": "corr-123"
}
